{
  "$schema": "../schema/design.schema.json",
  "format": "swarmpress.design.v1",
  "id": "camera-rig",
  "name": "Camera on a tripod",
  "footprint": [16, 16],
  "height": 64,
  "ops": [
    { "op": "box", "at": [2, 7, 0], "size": [12, 2, 2], "part": "brick", "colour": "black" },
    { "op": "box", "at": [7, 2, 0], "size": [2, 12, 2], "part": "brick", "colour": "black" },
    { "op": "box", "at": [7, 7, 2], "size": [2, 2, 46], "part": "brick", "colour": "grey-dark" },
    { "op": "box", "at": [6, 6, 48], "size": [4, 4, 2], "part": "brick", "colour": "black" },
    { "op": "box", "at": [5, 5, 50], "size": [6, 5, 8], "part": "brick", "colour": "black" },
    { "op": "box", "at": [7, 10, 51], "size": [2, 3, 5], "part": "brick", "colour": "grey-dark" },
    { "op": "box", "at": [7, 13, 52], "size": [2, 1, 3], "part": "tile", "colour": "glass" },
    { "op": "part", "part": "screen-4x2", "at": [6, 4, 51], "turn": 2, "colour": "screen-blue" },
    { "op": "box", "at": [7, 6, 58], "size": [2, 2, 3], "part": "brick", "colour": "black" }
  ],
  "provenance": { "kind": "kit" }
}
