{
  "$schema": "../schema/design.schema.json",
  "format": "swarmpress.design.v1",
  "id": "street-lamp",
  "name": "Street lamp",
  "footprint": [4, 4],
  "height": 128,
  "params": {"metal": {"type": "colour", "default": "black"}},
  "ops": [
    {"op": "box", "at": [0, 0, 0], "size": [4, 4, 3], "part": "brick", "colour": "$metal", "shape": "disc"},
    {"op": "box", "at": [1, 1, 3], "size": [2, 2, 3], "part": "brick", "colour": "$metal", "shape": "disc"},
    {"op": "repeat", "count": 33, "step": [0, 0, 3], "ops": [{"op": "part", "part": "round-brick-1x1", "at": [1, 1, 6], "colour": "$metal"}]},
    {"op": "box", "at": [0, 0, 105], "size": [4, 4, 2], "part": "plate", "colour": "$metal"},
    {"op": "mirror", "axis": "x", "ops": [{"op": "mirror", "axis": "z", "ops": [{"op": "box", "at": [0, 0, 107], "size": [1, 1, 12], "part": "brick", "colour": "$metal"}]}]},
    {"op": "repeat", "count": 12, "step": [0, 0, 1], "ops": [{"op": "part", "part": "round-tile-2x2", "at": [1, 1, 107], "colour": "bulb"}]},
    {"op": "box", "at": [0, 0, 119], "size": [4, 4, 3], "part": "brick", "colour": "$metal"},
    {"op": "box", "at": [1, 1, 122], "size": [2, 2, 6], "part": "plate", "colour": "$metal", "shape": "disc"}
  ],
  "tags": ["town"],
  "provenance": {"kind": "kit"}
}
