{
  "$schema": "../schema/design.schema.json",
  "format": "swarmpress.design.v1",
  "id": "stool",
  "name": "Stool",
  "footprint": [6, 6],
  "height": 18,
  "params": {
    "colour": { "type": "colour", "default": "red" }
  },
  "ops": [
    { "op": "box", "at": [0, 0, 0], "size": [6, 6, 1], "part": "plate", "colour": "black", "shape": "disc" },
    { "op": "box", "at": [2, 2, 1], "size": [2, 2, 15], "part": "brick", "colour": "grey-light" },
    { "op": "part", "part": "seat-4x4", "at": [1, 1, 16], "colour": "$colour" }
  ],
  "tags": ["seat"],
  "provenance": { "kind": "kit" }
}
