{
  "$schema": "../schema/design.schema.json",
  "format": "swarmpress.design.v1",
  "id": "coffee-machine",
  "name": "Coffee machine on a counter",
  "footprint": [16, 8],
  "height": 58,
  "params": {
    "doors": { "type": "colour", "default": "sage" }
  },
  "ops": [
    { "op": "box", "at": [0, 0, 0], "size": [16, 7, 2], "part": "brick", "colour": "grey-dark" },
    { "op": "box", "at": [0, 0, 2], "size": [16, 7, 34], "part": "brick", "colour": "white" },
    { "op": "box", "at": [0, 7, 2], "size": [16, 1, 34], "part": "brick", "colour": "$doors" },
    { "op": "box", "at": [7, 7, 4], "size": [2, 1, 30], "part": "brick", "colour": "white" },
    { "op": "box", "at": [0, 0, 36], "size": [16, 8, 1], "part": "tile", "colour": "grey-dark" },
    { "op": "box", "at": [5, 1, 37], "size": [6, 5, 17], "part": "brick", "colour": "black" },
    { "op": "box", "at": [5, 1, 54], "size": [6, 5, 1], "part": "tile", "colour": "grey-dark" },
    { "op": "box", "at": [6, 5, 37], "size": [4, 1, 8], "part": "empty" },
    { "op": "part", "part": "round-brick-1x1", "at": [7, 5, 37], "colour": "white" },
    { "op": "part", "part": "tile-1x1", "at": [9, 6, 50], "colour": "bulb" },
    { "op": "part", "part": "round-brick-1x1", "at": [12, 2, 37], "colour": "white" },
    { "op": "part", "part": "round-brick-1x1", "at": [13, 3, 37], "colour": "red" },
    { "op": "part", "part": "round-brick-2x2", "at": [1, 2, 37], "colour": "glass" }
  ],
  "provenance": { "kind": "kit" }
}
