{
  "format": "swarmpress.design.v1",
  "id": "site-town",
  "name": "Site town",
  "footprint": [
    76,
    30
  ],
  "height": 14,
  "ops": [
    {
      "op": "box",
      "at": [
        0,
        0,
        0
      ],
      "size": [
        76,
        30,
        1
      ],
      "part": "plate",
      "colour": "green"
    },
    {
      "op": "box",
      "at": [
        4,
        14,
        1
      ],
      "size": [
        8,
        8,
        3
      ],
      "part": "brick",
      "colour": "sand"
    },
    {
      "op": "box",
      "at": [
        4,
        14,
        4
      ],
      "size": [
        8,
        8,
        6
      ],
      "part": "brick",
      "colour": "glass"
    },
    {
      "op": "box",
      "at": [
        4,
        14,
        10
      ],
      "size": [
        8,
        8,
        3
      ],
      "part": "brick",
      "colour": "red"
    },
    {
      "op": "box",
      "at": [
        7,
        21,
        1
      ],
      "size": [
        2,
        1,
        3
      ],
      "part": "empty"
    },
    {
      "op": "box",
      "at": [
        16,
        14,
        1
      ],
      "size": [
        8,
        8,
        3
      ],
      "part": "brick",
      "colour": "grey-light"
    },
    {
      "op": "box",
      "at": [
        19,
        21,
        1
      ],
      "size": [
        2,
        1,
        3
      ],
      "part": "empty"
    },
    {
      "op": "box",
      "at": [
        28,
        14,
        1
      ],
      "size": [
        8,
        8,
        3
      ],
      "part": "brick",
      "colour": "sand"
    },
    {
      "op": "box",
      "at": [
        28,
        14,
        4
      ],
      "size": [
        8,
        8,
        6
      ],
      "part": "brick",
      "colour": "glass"
    },
    {
      "op": "box",
      "at": [
        28,
        14,
        10
      ],
      "size": [
        8,
        8,
        3
      ],
      "part": "brick",
      "colour": "red"
    },
    {
      "op": "box",
      "at": [
        31,
        21,
        1
      ],
      "size": [
        2,
        1,
        3
      ],
      "part": "empty"
    },
    {
      "op": "box",
      "at": [
        40,
        14,
        1
      ],
      "size": [
        8,
        8,
        3
      ],
      "part": "brick",
      "colour": "sand"
    },
    {
      "op": "box",
      "at": [
        40,
        14,
        4
      ],
      "size": [
        8,
        8,
        6
      ],
      "part": "brick",
      "colour": "glass"
    },
    {
      "op": "box",
      "at": [
        40,
        14,
        10
      ],
      "size": [
        8,
        8,
        3
      ],
      "part": "brick",
      "colour": "red"
    },
    {
      "op": "box",
      "at": [
        43,
        21,
        1
      ],
      "size": [
        2,
        1,
        3
      ],
      "part": "empty"
    },
    {
      "op": "box",
      "at": [
        52,
        14,
        1
      ],
      "size": [
        8,
        8,
        3
      ],
      "part": "brick",
      "colour": "sand"
    },
    {
      "op": "box",
      "at": [
        52,
        14,
        4
      ],
      "size": [
        8,
        8,
        6
      ],
      "part": "brick",
      "colour": "glass"
    },
    {
      "op": "box",
      "at": [
        52,
        14,
        10
      ],
      "size": [
        8,
        8,
        3
      ],
      "part": "brick",
      "colour": "red"
    },
    {
      "op": "box",
      "at": [
        55,
        21,
        1
      ],
      "size": [
        2,
        1,
        3
      ],
      "part": "empty"
    },
    {
      "op": "box",
      "at": [
        64,
        14,
        1
      ],
      "size": [
        8,
        8,
        3
      ],
      "part": "brick",
      "colour": "sand"
    },
    {
      "op": "box",
      "at": [
        64,
        14,
        4
      ],
      "size": [
        8,
        8,
        6
      ],
      "part": "brick",
      "colour": "glass"
    },
    {
      "op": "box",
      "at": [
        64,
        14,
        10
      ],
      "size": [
        8,
        8,
        3
      ],
      "part": "brick",
      "colour": "red"
    },
    {
      "op": "box",
      "at": [
        67,
        21,
        1
      ],
      "size": [
        2,
        1,
        3
      ],
      "part": "empty"
    },
    {
      "op": "box",
      "at": [
        0,
        22,
        1
      ],
      "size": [
        76,
        2,
        1
      ],
      "part": "tile",
      "colour": "grey-dark"
    },
    {
      "op": "box",
      "at": [
        8,
        24,
        1
      ],
      "size": [
        13,
        1,
        1
      ],
      "part": "tile",
      "colour": "sand"
    },
    {
      "op": "box",
      "at": [
        20,
        24,
        1
      ],
      "size": [
        1,
        1,
        1
      ],
      "part": "tile",
      "colour": "sand"
    },
    {
      "op": "box",
      "at": [
        8,
        24,
        1
      ],
      "size": [
        1,
        1,
        1
      ],
      "part": "tile",
      "colour": "sand"
    },
    {
      "op": "box",
      "at": [
        66,
        4,
        1
      ],
      "size": [
        6,
        6,
        1
      ],
      "part": "plate",
      "colour": "grey-light"
    },
    {
      "op": "box",
      "at": [
        67,
        5,
        2
      ],
      "size": [
        4,
        4,
        5
      ],
      "part": "tile",
      "colour": "cork"
    },
    {
      "op": "box",
      "at": [
        59,
        4,
        1
      ],
      "size": [
        6,
        6,
        1
      ],
      "part": "plate",
      "colour": "grey-light"
    },
    {
      "op": "box",
      "at": [
        60,
        5,
        2
      ],
      "size": [
        4,
        4,
        6
      ],
      "part": "tile",
      "colour": "cork"
    }
  ],
  "provenance": {
    "kind": "view",
    "source": "blueprint",
    "hash": "274aae5707937917b39caa1d8e95010048b19a13e47986bf62e0c2546009e5b2"
  }
}
