{
  "$schema": "../schema/design.schema.json",
  "format": "swarmpress.design.v1",
  "id": "ceiling-light",
  "name": "Ceiling light",
  "mount": "ceiling",
  "footprint": [4, 4],
  "height": 24,
  "params": {
    "shade": { "type": "colour", "default": "white" }
  },
  "ops": [
    { "op": "box", "at": [0, 0, 23], "size": [4, 4, 1], "part": "plate", "colour": "white" },
    { "op": "repeat", "count": 5, "step": [0, 0, 3], "ops": [
      { "op": "part", "part": "round-brick-2x2", "at": [1, 1, 8], "colour": "grey-dark" }
    ] },
    { "op": "part", "part": "lamp-head-4x4", "at": [0, 0, 4], "colour": "$shade" },
    { "op": "part", "part": "round-tile-2x2", "at": [1, 1, 3], "colour": "bulb" }
  ],
  "tags": ["light"],
  "provenance": { "kind": "kit" }
}
