{
  "$schema": "../schema/design.schema.json",
  "format": "swarmpress.design.v1",
  "id": "chair",
  "name": "Office chair",
  "footprint": [8, 8],
  "height": 44,
  "params": {
    "colour": { "type": "colour", "default": "red" }
  },
  "ops": [
    { "op": "box", "at": [1, 3, 0], "size": [6, 2, 1], "part": "plate", "colour": "black" },
    { "op": "box", "at": [3, 1, 0], "size": [2, 6, 1], "part": "plate", "colour": "black" },
    { "op": "box", "at": [3, 3, 1], "size": [2, 2, 13], "part": "brick", "colour": "grey-light" },
    { "op": "box", "at": [0, 0, 14], "size": [8, 7, 2], "part": "plate", "colour": "black" },
    { "op": "part", "part": "seat-6x6", "at": [1, 0, 16], "colour": "$colour" },
    { "op": "box", "at": [3, 7, 14], "size": [2, 1, 10], "part": "brick", "colour": "black" },
    { "op": "box", "at": [0, 7, 24], "size": [8, 1, 20], "part": "brick", "colour": "$colour" },
    { "op": "mirror", "axis": "x", "ops": [
      { "op": "box", "at": [0, 3, 16], "size": [1, 1, 8], "part": "brick", "colour": "black" },
      { "op": "box", "at": [0, 1, 24], "size": [1, 5, 1], "part": "plate", "colour": "black" }
    ] }
  ],
  "tags": ["seat"],
  "provenance": { "kind": "kit" }
}
